#,"Campaña o aviso institucional","Clasificación del servicio","Categoría del servicio","Subcategoría del servicio",Unidad,"Sujeto obligado contratante","Partida del contratante","Sujeto obligado solicitante","Partida del solicitante","Área administrativa encargada de solicitar el servicio","Descripción del servicio o producto adquirido",Cantidad,"Precio unitario con I.V.A. incluido","Fecha de validación","Área responsable de la información",Año,"Fecha de actualización",Nota,Estatus
1,"Logros de gobiernos municipal, tarjetas de mi  apoyo  mi bienestar	DA","Servicios de difusión en medios de comunicación",Televisión,"Televisión abierta local",Spot,Chihuahua,"3600 - 362 - 36201 - Difusión de mensajes comerciales para promover la venta de productos o servicios",Chihuahua,,"coordinación de comunicacion social","


publicidad en television via spot  de avisos oficiales  atravez de la programacion  de canal 6.4 durante a



 ",650.00,"$ 2,175.00",09.10.2019,"Unidad administrativa de la coordinación de comunicación social",2019,30.09.2019,"


La información referente a los avisos institucionales/campañas publicitarias es inexacta, ya que la información obtenida de la PNT manifiesta errores y no se encuentra relacionada con el detalle de las facturas, sin embargo los montos son correctos. Las cantidades unitarias que muestran un número uno señalan que el medio está detallando sólo una unidad de servicio, por lo que no es un precio unitario en sí. Las Campañas catalogadas como ""Sin especificar"" se deben a que no se encontró campaña alguna para relacionarla con el detalle de la factura en cuestión.



 ",Activo
