#,"Campaña o aviso institucional","Clasificación del servicio","Categoría del servicio","Subcategoría del servicio",Unidad,"Sujeto obligado contratante","Partida del contratante","Sujeto obligado solicitante","Partida del solicitante","Área administrativa encargada de solicitar el servicio","Descripción del servicio o producto adquirido",Cantidad,"Precio unitario con I.V.A. incluido","Fecha de validación","Área responsable de la información",Año,"Fecha de actualización",Nota,Estatus
1,"Entregando becas","Servicios de difusión en medios de comunicación",Internet,"Medios Digitales",Banner,Chihuahua,"3600 - 361 - 36101 - Difusión de mensajes sobre programas y actividades gubernamentales",Chihuahua,,"Unidad Administrativa de la Coordinación de Comunicación Social","


SERVICIO DE PUBLICACIONES OFICIALES PARA DIFUSIÓN E INFORMACIÓN EN MATERIA COMERCIAL DIGITAL VÍA ORDEN DE BANNER EN LOS DIVERSOS PERIÓDICOS Y PÁGINAS WEB, ESPECÍFICAMENTE EN LAS PÁGINAS QUE A CONTINUACIÓN SE DETALLAN, PARA LA CORRECTA COMUNICACIÓN SOCIAL DEL GOBIERNO MUNICIPAL: WWW.EXPANSION.MX, WWW.POLITICA.EXPANSION.MX, WWW.QUIEN.COM Y WWW.LIFEANDSTYLE.MX



 ",1.00,"$ 400,000.00",,,,,"


SERVICIO DE PUBLICACIONES OFICIALES PARA DIFUSIÓN E INFORMACIÓN EN MATERIA COMERCIAL DIGITAL VÍA ORDEN DE BANNER EN LOS DIVERSOS PERIÓDICOS Y PÁGINAS WEB, ESPECÍFICAMENTE EN LAS PÁGINAS QUE A CONTINUACIÓN SE DETALLAN, PARA LA CORRECTA COMUNICACIÓN SOCIAL DEL GOBIERNO MUNICIPAL: WWW.EXPANSION.MX, WWW.POLITICA.EXPANSION.MX, WWW.QUIEN.COM Y WWW.LIFEANDSTYLE.MX



 ",Activo
